{
	"format_version": 1,
	"id": "movement_lab",
	"name": "移动模块试验场",
	"width": 42,
	"height": 20,
	"tiles": [
		{
			"x": 1,
			"y": 1,
			"tile_id": "floor"
		},
		{
			"x": 2,
			"y": 1,
			"tile_id": "floor"
		},
		{
			"x": 3,
			"y": 1,
			"tile_id": "floor"
		},
		{
			"x": 4,
			"y": 1,
			"tile_id": "floor"
		},
		{
			"x": 5,
			"y": 1,
			"tile_id": "floor"
		},
		{
			"x": 6,
			"y": 1,
			"tile_id": "floor"
		},
		{
			"x": 7,
			"y": 1,
			"tile_id": "floor"
		},
		{
			"x": 8,
			"y": 1,
			"tile_id": "floor"
		},
		{
			"x": 9,
			"y": 1,
			"tile_id": "floor"
		},
		{
			"x": 10,
			"y": 1,
			"tile_id": "floor"
		},
		{
			"x": 1,
			"y": 2,
			"tile_id": "floor"
		},
		{
			"x": 2,
			"y": 2,
			"tile_id": "floor"
		},
		{
			"x": 3,
			"y": 2,
			"tile_id": "floor"
		},
		{
			"x": 4,
			"y": 2,
			"tile_id": "floor"
		},
		{
			"x": 5,
			"y": 2,
			"tile_id": "floor"
		},
		{
			"x": 6,
			"y": 2,
			"tile_id": "floor"
		},
		{
			"x": 7,
			"y": 2,
			"tile_id": "floor"
		},
		{
			"x": 8,
			"y": 2,
			"tile_id": "floor"
		},
		{
			"x": 9,
			"y": 2,
			"tile_id": "floor"
		},
		{
			"x": 10,
			"y": 2,
			"tile_id": "floor"
		},
		{
			"x": 1,
			"y": 3,
			"tile_id": "floor"
		},
		{
			"x": 2,
			"y": 3,
			"tile_id": "floor"
		},
		{
			"x": 9,
			"y": 3,
			"tile_id": "floor"
		},
		{
			"x": 10,
			"y": 3,
			"tile_id": "floor"
		},
		{
			"x": 30,
			"y": 3,
			"tile_id": "floor"
		},
		{
			"x": 1,
			"y": 4,
			"tile_id": "floor"
		},
		{
			"x": 2,
			"y": 4,
			"tile_id": "floor"
		},
		{
			"x": 9,
			"y": 4,
			"tile_id": "floor"
		},
		{
			"x": 10,
			"y": 4,
			"tile_id": "floor"
		},
		{
			"x": 30,
			"y": 4,
			"tile_id": "floor"
		},
		{
			"x": 1,
			"y": 5,
			"tile_id": "floor"
		},
		{
			"x": 2,
			"y": 5,
			"tile_id": "floor"
		},
		{
			"x": 9,
			"y": 5,
			"tile_id": "floor"
		},
		{
			"x": 10,
			"y": 5,
			"tile_id": "floor"
		},
		{
			"x": 19,
			"y": 5,
			"tile_id": "floor"
		},
		{
			"x": 30,
			"y": 5,
			"tile_id": "floor"
		},
		{
			"x": 1,
			"y": 6,
			"tile_id": "floor"
		},
		{
			"x": 2,
			"y": 6,
			"tile_id": "floor"
		},
		{
			"x": 9,
			"y": 6,
			"tile_id": "floor"
		},
		{
			"x": 10,
			"y": 6,
			"tile_id": "floor"
		},
		{
			"x": 19,
			"y": 6,
			"tile_id": "floor"
		},
		{
			"x": 30,
			"y": 6,
			"tile_id": "floor"
		},
		{
			"x": 1,
			"y": 7,
			"tile_id": "floor"
		},
		{
			"x": 2,
			"y": 7,
			"tile_id": "floor"
		},
		{
			"x": 3,
			"y": 7,
			"tile_id": "floor"
		},
		{
			"x": 4,
			"y": 7,
			"tile_id": "floor"
		},
		{
			"x": 5,
			"y": 7,
			"tile_id": "floor"
		},
		{
			"x": 6,
			"y": 7,
			"tile_id": "floor"
		},
		{
			"x": 7,
			"y": 7,
			"tile_id": "floor"
		},
		{
			"x": 8,
			"y": 7,
			"tile_id": "floor"
		},
		{
			"x": 9,
			"y": 7,
			"tile_id": "floor"
		},
		{
			"x": 10,
			"y": 7,
			"tile_id": "floor"
		},
		{
			"x": 20,
			"y": 7,
			"tile_id": "floor"
		},
		{
			"x": 30,
			"y": 7,
			"tile_id": "floor"
		},
		{
			"x": 1,
			"y": 8,
			"tile_id": "floor"
		},
		{
			"x": 2,
			"y": 8,
			"tile_id": "floor"
		},
		{
			"x": 3,
			"y": 8,
			"tile_id": "floor"
		},
		{
			"x": 4,
			"y": 8,
			"tile_id": "floor"
		},
		{
			"x": 5,
			"y": 8,
			"tile_id": "floor"
		},
		{
			"x": 6,
			"y": 8,
			"tile_id": "floor"
		},
		{
			"x": 7,
			"y": 8,
			"tile_id": "floor"
		},
		{
			"x": 8,
			"y": 8,
			"tile_id": "floor"
		},
		{
			"x": 9,
			"y": 8,
			"tile_id": "floor"
		},
		{
			"x": 10,
			"y": 8,
			"tile_id": "floor"
		},
		{
			"x": 20,
			"y": 8,
			"tile_id": "floor"
		},
		{
			"x": 21,
			"y": 8,
			"tile_id": "floor"
		},
		{
			"x": 30,
			"y": 8,
			"tile_id": "floor"
		},
		{
			"x": 21,
			"y": 9,
			"tile_id": "floor"
		},
		{
			"x": 22,
			"y": 9,
			"tile_id": "floor"
		},
		{
			"x": 23,
			"y": 9,
			"tile_id": "floor"
		},
		{
			"x": 30,
			"y": 9,
			"tile_id": "floor"
		},
		{
			"x": 23,
			"y": 10,
			"tile_id": "floor"
		},
		{
			"x": 24,
			"y": 10,
			"tile_id": "floor"
		},
		{
			"x": 25,
			"y": 10,
			"tile_id": "floor"
		},
		{
			"x": 26,
			"y": 10,
			"tile_id": "floor"
		},
		{
			"x": 27,
			"y": 10,
			"tile_id": "floor"
		},
		{
			"x": 30,
			"y": 10,
			"tile_id": "floor"
		},
		{
			"x": 28,
			"y": 11,
			"tile_id": "floor"
		},
		{
			"x": 29,
			"y": 11,
			"tile_id": "floor"
		},
		{
			"x": 30,
			"y": 11,
			"tile_id": "floor"
		},
		{
			"x": 29,
			"y": 12,
			"tile_id": "floor"
		},
		{
			"x": 30,
			"y": 12,
			"tile_id": "floor"
		}
	],
	"player_spawn": {
		"position": {
			"x": 1.5,
			"y": 1.5
		},
		"modules": [
			{
				"id": "drive",
				"module_id": "movement",
				"offset": {
					"x": 0.0,
					"y": 0.0
				}
			}
		]
	},
	"enemies": [],
	"objects": [],
	"dialogue": [
		{
			"speaker": "系统",
			"text": "沿地板移动。未铺设地块的区域为 void，机器无法通行。"
		}
	],
	"properties": {
		"level": {
			"max_ticks": 600.0,
			"completion_mode": "reach_or_clear"
		}
	}
}
